Survived,Name,Age,SibSp,Parch,Ticket,Fare,Q,S,Pclass_2,Pclass_3,Sex_1,AgeGroup
0,"Petroff, Mr. Nedelio",19.0,0,0,349212,0.015411575213749286,0,1,0,1,1,Adulto
0,"Laleff, Mr. Kristo",25.14061971830986,0,0,349217,0.015411575213749286,0,1,0,1,1,Adulto
1,"Potter, Mrs. Thomas Jr (Lily Alexenia Wilson)",56.0,0,1,11767,0.16231419173453318,0,0,0,0,0,Adulto
1,"Shelley, Mrs. William (Imanita Parrish Hall)",25.0,0,1,230433,0.050748620223090936,0,1,1,0,0,Adulto
0,"Markun, Mr. Johann",33.0,0,0,349257,0.015411575213749286,0,1,0,1,1,Adulto
0,"Dahlberg, Miss. Gerda Ulrika",22.0,0,0,7552,0.02052723131923771,0,1,0,1,0,Adulto
0,"Banfield, Mr. Frederick James",28.0,0,0,C.A./SOTON 34068,0.020494635090094415,0,1,1,0,1,Adulto
0,"Sutehall, Mr. Henry Jr",25.0,0,0,SOTON/OQ 392076,0.013760683560491965,0,1,0,1,1,Adulto
0,"Rice, Mrs. William (Margaret Norton)",39.0,0,5,382652,0.05684821399990475,1,0,0,1,0,Adulto
0,"Montvila, Rev. Juozas",27.0,0,0,211536,0.025374310111545468,0,1,1,0,1,Adulto
1,"Graham, Miss. Margaret Edith",19.0,0,0,112053,0.05855610025741262,0,1,0,0,0,Adulto
0,"Johnston, Miss. Catherine Helen ""Carrie""",25.14061971830986,1,2,W./C. 6607,0.04577135170121086,0,1,0,1,0,Adulto
1,"Behr, Mr. Karl Howell",26.0,0,0,111369,0.05855610025741262,0,0,0,0,1,Adulto
0,"Dooley, Mr. Patrick",32.0,0,0,370376,0.015126992566498259,1,0,0,1,1,Adulto
