Survived,Name,Age,SibSp,Parch,Ticket,Fare,Q,S,Pclass_2,Pclass_3,Sex_1,AgeGroup
0,"Levy, Mr. Rene Jacques",36.0,0,0,SC/Paris 2163,0.025130326360472913,0,0,1,0,1,Adulto
0,"Haas, Miss. Aloisia",24.0,0,0,349236,0.01727404957593672,0,1,0,1,0,Adulto
0,"Mineff, Mr. Ivan",24.0,0,0,349233,0.015411575213749286,0,1,0,1,1,Adulto
0,"Lewy, Mr. Ervin G",38.233440860215055,0,0,PC 17612,0.05410739813385612,0,0,0,0,1,Adulto
0,"Hanna, Mr. Mansour",23.5,0,0,2693,0.014110458666029575,0,0,0,1,1,Adulto
0,"Allison, Miss. Helen Loraine",2.0,1,2,113781,0.29580589980036276,0,1,0,0,0,Criança
1,"Saalfeld, Mr. Adolphe",38.233440860215055,0,0,19988,0.05953203526170282,0,1,0,0,1,Adulto
1,"Baxter, Mrs. James (Helene DeLaudeniere Chaput)",50.0,0,1,PC 17558,0.4831284260198326,0,0,0,0,0,Adulto
1,"Kelly, Miss. Anna Katherine ""Annie Kate""",25.14061971830986,0,0,9234,0.015126992566498259,1,0,0,1,0,Adulto
1,"McCoy, Mr. Bernard",25.14061971830986,2,0,367226,0.04538097769949478,1,0,0,1,1,Adulto
0,"Johnson, Mr. William Cahoone Jr",19.0,0,0,LINE,0.0,0,1,0,1,1,Adulto
1,"Keane, Miss. Nora A",29.87763005780347,0,0,226593,0.024105594605968193,1,0,1,0,0,Adulto
0,"Williams, Mr. Howard Hugh ""Harry""",25.14061971830986,0,0,A/5 2466,0.015712553569072387,0,1,0,1,1,Adulto
1,"Allison, Master. Hudson Trevor",0.92,1,2,113781,0.29580589980036276,0,1,0,0,1,Criança
1,"Fleming, Miss. Margaret",38.233440860215055,0,0,17421,0.21642978772242535,0,0,0,0,0,Adulto
1,"Penasco y Castellana, Mrs. Victor de Satode (Maria Josefa Perez de Soto y Vallejo)",17.0,1,0,PC 17758,0.2125586439344078,0,0,0,0,0,Jovem
0,"Abelson, Mr. Samuel",30.0,1,0,P/PP 3381,0.04684488020593009,0,0,1,0,1,Adulto
1,"Francatelli, Miss. Laura Mabel",30.0,0,0,PC 17485,0.11111839809247648,0,0,0,0,0,Adulto
1,"Hays, Miss. Margaret Bechstein",24.0,0,0,11767,0.16231419173453318,0,0,0,0,0,Adulto
1,"Ryerson, Miss. Emily Borie",18.0,2,2,PC 17608,0.5121218935012878,0,0,0,0,0,Adulto
0,"Lahtinen, Mrs. William (Anna Sylfven)",26.0,1,1,250651,0.050748620223090936,0,1,1,0,0,Adulto
0,"Hendekovic, Mr. Ignjac",28.0,0,0,349243,0.015411575213749286,0,1,0,1,1,Adulto
0,"Hart, Mr. Benjamin",43.0,1,1,F.C.C. 13529,0.05123658772523604,0,1,1,0,1,Adulto
1,"Nilsson, Miss. Helmina Josefina",26.0,0,0,347470,0.015330377421392339,0,1,0,1,0,Adulto
1,"Kantor, Mrs. Sinai (Miriam Sternin)",24.0,1,0,244367,0.050748620223090936,0,1,1,0,0,Adulto
0,"Moraweck, Dr. Ernest",54.0,0,0,29011,0.027326180120125887,0,1,1,0,1,Adulto
1,"Wick, Miss. Mary Natalie",31.0,0,2,36928,0.32179836714362564,0,1,0,0,0,Adulto
1,"Spedden, Mrs. Frederic Oakley (Margaretta Corning Stone)",40.0,1,1,16966,0.2625265161540666,0,0,0,0,0,Adulto
0,"Dennis, Mr. Samuel",22.0,0,0,A/5 21172,0.014151057562208049,0,1,0,1,1,Adulto
0,"Danoff, Mr. Yoto",27.0,0,0,349219,0.015411575213749286,0,1,0,1,1,Adulto
1,"Slayter, Miss. Hilda Mary",30.0,0,0,234818,0.024105594605968193,1,0,1,0,0,Adulto
1,"Caldwell, Mrs. Albert Francis (Sylvia Mae Harbaugh)",22.0,1,1,248738,0.056604230248832196,0,1,1,0,0,Adulto
0,"Sage, Mr. George John Jr",25.14061971830986,8,2,CA. 2343,0.13575255909676825,0,1,0,1,1,Adulto
1,"Young, Miss. Marie Grice",36.0,0,0,PC 17760,0.2647385704347907,0,0,0,0,0,Adulto
0,"Nysveen, Mr. Johan Hansen",61.0,0,0,345364,0.012174789178520372,0,1,0,1,1,Idoso
1,"Ball, Mrs. (Ada E Hall)",36.0,0,0,28551,0.025374310111545468,0,1,1,0,0,Adulto
1,"Goldsmith, Mrs. Frank John (Emily Alice Brown)",31.0,1,1,363291,0.04006213192611313,0,1,0,1,0,Adulto
1,"Hippach, Miss. Jean Gertrude",16.0,0,1,111361,0.11316786160148591,0,0,0,0,0,Jovem
1,"McCoy, Miss. Agnes",25.14061971830986,2,0,367226,0.04538097769949478,1,0,0,1,0,Adulto
0,"Partner, Mr. Austen",45.5,0,0,113043,0.055628295244541985,0,1,0,0,1,Adulto
0,"Graham, Mr. George Edward",38.0,0,1,PC 17582,0.2995388511917728,0,1,0,0,1,Adulto
0,"Vander Planke, Mr. Leo Edmondus",16.0,2,0,345764,0.03513366015444757,0,1,0,1,1,Jovem
1,"Frauenthal, Mrs. Henry William (Clara Heinsheimer)",38.233440860215055,1,0,PC 17611,0.2608674266467732,0,1,0,0,0,Adulto
0,"Denkoff, Mr. Mitto",25.14061971830986,0,0,349225,0.015411575213749286,0,1,0,1,1,Adulto
0,"Pears, Mr. Thomas Clinton",29.0,1,0,113776,0.12999454257145598,0,1,0,0,1,Adulto
1,"Burns, Miss. Elizabeth Margaret",41.0,0,0,16966,0.2625265161540666,0,0,0,0,0,Adulto
1,"Dahl, Mr. Karl Edwart",45.0,0,0,7598,0.015712553569072387,0,1,0,1,1,Adulto
0,"Blackwell, Mr. Stephen Weart",45.0,0,0,113784,0.06929138530460494,0,1,0,0,1,Adulto
1,"Navratil, Master. Edmond Roger",2.0,1,1,230080,0.050748620223090936,0,1,1,0,1,Criança
1,"Fortune, Miss. Alice Elizabeth",24.0,3,2,19950,0.5133418122566507,0,1,0,0,0,Adulto
0,"Collander, Mr. Erik Gustaf",28.0,0,0,248740,0.025374310111545468,0,1,1,0,1,Adulto
0,"Sedgwick, Mr. Charles Frederick Waddington",25.0,0,0,244361,0.025374310111545468,0,1,1,0,1,Adulto
0,"Fox, Mr. Stanley Hubert",36.0,0,0,229236,0.025374310111545468,0,1,1,0,1,Adulto
1,"Brown, Miss. Amelia ""Mildred""",24.0,0,0,248733,0.025374310111545468,0,1,1,0,0,Adulto
1,"Smith, Miss. Marion Elsie",40.0,0,0,31418,0.025374310111545468,0,1,1,0,0,Adulto
1,"Davison, Mrs. Thomas Henry (Mary E Finck)",25.14061971830986,1,0,386525,0.031425107138144774,0,1,0,1,0,Adulto
1,"Coutts, Master. William Loch ""William""",3.0,1,1,C.A. 37671,0.031034733136428686,0,1,0,1,1,Criança
0,"Dimic, Mr. Jovan",42.0,0,0,315088,0.016908073949327893,0,1,0,1,1,Adulto
0,"Odahl, Mr. Nils Martin",23.0,0,0,7267,0.01800600082915438,0,1,0,1,1,Adulto
0,"Williams-Lambert, Mr. Fletcher Fellows",38.233440860215055,0,0,113510,0.06831545030031472,0,1,0,0,1,Adulto
0,"Elias, Mr. Tannous",15.0,1,1,2695,0.014110458666029575,0,0,0,1,1,Jovem
0,"Arnold-Franchi, Mr. Josef",25.0,1,0,349237,0.034743286152731485,0,1,0,1,1,Adulto
0,"Yousif, Mr. Wazli",25.14061971830986,0,0,2647,0.014102260811993537,0,0,0,1,1,Adulto
0,"Vanden Steen, Mr. Leo Peter",28.0,0,0,345783,0.018542765081513996,0,1,0,1,1,Adulto
1,"Bowerman, Miss. Elsie Edith",22.0,0,1,113505,0.10735285047192313,0,1,0,0,0,Adulto
0,"Funk, Miss. Annie Clemmer",38.0,0,0,237671,0.025374310111545468,0,1,1,0,0,Adulto
1,"McGovern, Miss. Mary",25.14061971830986,0,0,330931,0.01537917417160685,1,0,0,1,0,Adulto
1,"Mockler, Miss. Helen Mary ""Ellie""",25.14061971830986,0,0,330980,0.01537917417160685,1,0,0,1,0,Adulto
0,"Skoog, Mr. Wilhelm",40.0,1,4,347088,0.05445717323939373,0,1,0,1,1,Adulto
0,"del Carlo, Mr. Sebastiano",29.0,1,0,SC/PARIS 2167,0.05410739813385612,0,0,1,0,1,Adulto
0,"Barbara, Mrs. (Catherine David)",45.0,0,1,2691,0.028212719478023115,0,0,0,1,0,Adulto
0,"Asim, Mr. Adola",35.0,0,0,SOTON/O.Q. 3101310,0.013760683560491965,0,1,0,1,1,Adulto
0,"O'Brien, Mr. Thomas",25.14061971830986,1,0,370365,0.030253985132996517,1,0,0,1,1,Adulto
0,"Adahl, Mr. Mauritz Nils Martin",30.0,0,0,C 7076,0.014151057562208049,0,1,0,1,1,Adulto
1,"Warren, Mrs. Frank Manley (Anna Sophia Atkinson)",60.0,1,0,110813,0.14687821814567664,0,0,0,0,0,Idoso
1,"Moussa, Mrs. (Mantoura Boulos)",25.14061971830986,0,0,2626,0.014110458666029575,0,0,0,1,0,Adulto
1,"Jermyn, Miss. Annie",25.14061971830986,0,0,14313,0.015126992566498259,1,0,0,1,0,Adulto
1,"Aubart, Mme. Leontine Pauline",24.0,0,0,PC 17477,0.13526459159462315,0,0,0,0,0,Adulto
1,"Harder, Mr. George Achilles",25.0,1,0,11765,0.1082149914547131,0,0,0,0,1,Adulto
0,"Wiklund, Mr. Jakob Alfred",18.0,1,0,3101267,0.012678957201736696,0,1,0,1,1,Adulto
0,"Beavan, Mr. William Thomas",19.0,0,0,323951,0.015712553569072387,0,1,0,1,1,Adulto
0,"Ringhini, Mr. Sante",22.0,0,0,PC 17760,0.2647385704347907,0,0,0,0,1,Adulto
0,"Palsson, Miss. Stina Viola",3.0,3,1,349909,0.04113566043083236,0,1,0,1,0,Criança
1,"Meyer, Mrs. Edgar Joseph (Leila Saks)",38.233440860215055,1,0,PC 17604,0.16038672010106003,0,0,0,0,0,Adulto
1,"Landergren, Miss. Aurora Adelia",22.0,0,0,C 7077,0.014151057562208049,0,1,0,1,0,Adulto
0,"Widener, Mr. Harry Elkins",27.0,0,2,113503,0.41282050681475896,0,0,0,0,1,Adulto
0,"Betros, Mr. Tannous",20.0,0,0,2648,0.007831878409428937,0,0,0,1,1,Adulto
0,"Gustafsson, Mr. Karl Gideon",19.0,0,0,347069,0.015175789316712771,0,1,0,1,1,Adulto
1,"Bidois, Miss. Rosalie",42.0,0,0,PC 17757,0.4440992237022602,0,0,0,0,0,Adulto
1,"Nakid, Miss. Maria (""Mary"")",1.0,0,2,2653,0.030725752114070404,0,0,0,1,0,Criança
0,"Tikkanen, Mr. Juho",32.0,0,0,STON/O 2. 3101293,0.015468569817999833,0,1,0,1,1,Adulto
1,"Holverson, Mrs. Alexander Oskar (Mary Aline Towner)",35.0,1,0,113789,0.10149724044618187,0,1,0,0,0,Adulto
0,"Plotcharsky, Mr. Vasil",25.14061971830986,0,0,349227,0.015411575213749286,0,1,0,1,1,Adulto
0,"Davies, Mr. Charles Henry",18.0,0,0,S.O.C. 14879,0.1434624456306609,0,1,1,0,1,Adulto
0,"Goodwin, Master. Sidney Leonard",1.0,5,2,CA 2144,0.09154270340242172,0,1,0,1,1,Criança
1,"Buss, Miss. Kate",36.0,0,0,27849,0.025374310111545468,0,1,1,0,0,Adulto
0,"Sadlier, Mr. Matthew",25.14061971830986,0,0,367655,0.015086393670319786,1,0,0,1,1,Adulto
1,"Lehmann, Miss. Bertha",17.0,0,0,SC 1748,0.023422440102965045,0,0,1,0,0,Jovem
1,"Carter, Mr. William Ernest",36.0,1,2,113760,0.23422440102965048,0,1,0,0,1,Adulto
1,"Jansson, Mr. Carl Olof",21.0,0,0,350034,0.015216388212891242,0,1,0,1,1,Adulto
0,"Gustafsson, Mr. Johan Birger",28.0,2,0,3101277,0.015468569817999833,0,1,0,1,1,Adulto
1,"Newell, Miss. Marjorie",23.0,1,0,35273,0.22109807522194713,0,0,0,0,0,Adulto
1,"Sandstrom, Mrs. Hjalmar (Agnes Charlotta Bengtsson)",24.0,0,2,PP 9549,0.03259622914329302,0,1,0,1,0,Adulto
0,"Johansson, Mr. Erik",22.0,0,0,350052,0.015216388212891242,0,1,0,1,1,Adulto
0,"Olsson, Miss. Elina",31.0,0,0,350407,0.015330377421392339,0,1,0,1,0,Adulto
0,"McKane, Mr. Peter David",46.0,0,0,28403,0.050748620223090936,0,1,1,0,1,Adulto
0,"Pain, Dr. Alfred",23.0,0,0,244278,0.020494635090094415,0,1,1,0,1,Adulto
1,"Trout, Mrs. William H (Jessie L)",28.0,0,0,240929,0.02469115560854232,0,1,1,0,0,Adulto
1,"Niskanen, Mr. Juha",39.0,0,0,STON/O 2. 3101289,0.015468569817999833,0,1,0,1,1,Adulto
0,"Adams, Mr. John",26.0,0,0,341826,0.015712553569072387,0,1,0,1,1,Adulto
0,"Jussila, Miss. Mari Aina",21.0,1,0,4137,0.019177122834302632,0,1,0,1,0,Adulto
0,"Hakkarainen, Mr. Pekka Pietari",28.0,1,0,STON/O2. 3101279,0.030937139635999665,0,1,0,1,1,Adulto
0,"Oreskovic, Miss. Marija",20.0,0,0,315096,0.016908073949327893,0,1,0,1,0,Adulto
0,"Gale, Mr. Shadrach",34.0,1,0,28664,0.04098927018018883,0,1,1,0,1,Adulto
0,"Widegren, Mr. Carl/Charles Peter",51.0,0,0,347064,0.015126992566498259,0,1,0,1,1,Adulto
1,"Richards, Master. William Rowe",3.0,1,1,29106,0.03659756266088288,0,1,1,0,1,Criança
0,"Birkeland, Mr. Hans Martin Monsen",21.0,0,0,312992,0.015175789316712771,0,1,0,1,1,Adulto
0,"Lefebre, Miss. Ida",25.14061971830986,3,1,4133,0.049707687947515,0,1,0,1,0,Adulto
0,"Sdycoff, Mr. Todor",25.14061971830986,0,0,349222,0.015411575213749286,0,1,0,1,1,Adulto
0,"Hart, Mr. Henry",25.14061971830986,0,0,394140,0.013386510079847098,1,0,0,1,1,Adulto
1,"Minahan, Miss. Daisy E",33.0,1,0,19928,0.17566830077223786,1,0,0,0,0,Adulto
0,"Cunningham, Mr. Alfred Fleming",29.87763005780347,0,0,239853,0.0,0,1,1,0,1,Adulto
1,"Sundman, Mr. Johan Julian",44.0,0,0,STON/O 2. 3101269,0.015468569817999833,0,1,0,1,1,Adulto
0,"Meek, Mrs. Thomas (Annie Louise Rowley)",25.14061971830986,0,0,343095,0.015712553569072387,0,1,0,1,0,Adulto
1,"Drew, Mrs. James Vivian (Lulu Thorne Christian)",34.0,1,1,28220,0.06343577527886367,0,1,1,0,0,Adulto
1,"Silven, Miss. Lyyli Karoliina",18.0,0,2,250652,0.025374310111545468,0,1,1,0,0,Adulto
0,"Matthews, Mr. William John",30.0,0,0,28228,0.025374310111545468,0,1,1,0,1,Adulto
0,"Van Impe, Miss. Catharina",10.0,0,2,345773,0.04713766070721715,0,1,0,1,0,Criança
0,"Gheorgheff, Mr. Stanio",25.14061971830986,0,0,349254,0.015411575213749286,0,0,0,1,1,Adulto
0,"Charters, Mr. David",21.0,0,0,A/5. 13032,0.015094396337354966,1,0,0,1,1,Adulto
0,"Zimmerman, Mr. Leo",29.0,0,0,315082,0.015370976317570811,0,1,0,1,1,Adulto
0,"Danbom, Mrs. Ernst Gilbert (Anna Sigrid Maria Brogren)",28.0,1,1,347080,0.028106928123558056,0,1,0,1,0,Adulto
0,"Rosblom, Mr. Viktor Richard",18.0,1,1,370129,0.039452172548431745,0,1,0,1,1,Adulto
0,"Wiseman, Mr. Phillippe",25.14061971830986,0,0,A/4. 34244,0.014151057562208049,0,1,0,1,1,Adulto
1,"Clarke, Mrs. Charles V (Ada Maria Winfield)",28.0,1,0,2003,0.050748620223090936,0,1,1,0,0,Adulto
1,"Phillips, Miss. Kate Florence (""Mrs Kate Louise Phillips Marshall"")",19.0,0,0,250655,0.050748620223090936,0,1,1,0,0,Adulto
0,"Flynn, Mr. James",25.14061971830986,0,0,364851,0.015126992566498259,1,0,0,1,1,Adulto
1,"Pickard, Mr. Berk (Berk Trembisky)",32.0,0,0,SOTON/O.Q. 392078,0.015712553569072387,0,1,0,1,1,Adulto
1,"Bjornstrom-Steffansson, Mr. Mauritz Hakan",28.0,0,0,110564,0.051822148727810165,0,1,0,0,1,Adulto
1,"Thorneycroft, Mrs. Percival (Florence Kate White)",25.14061971830986,1,0,376564,0.031425107138144774,0,1,0,1,0,Adulto
1,"Louch, Mrs. Charles Alexander (Alice Adelaide Slow)",42.0,1,0,SC/AH 3085,0.050748620223090936,0,1,1,0,0,Adulto
0,"Kallio, Mr. Nikolai Erland",17.0,0,0,STON/O 2. 3101274,0.013907073811135496,0,1,0,1,1,Jovem
0,"Silvey, Mr. William Baird",50.0,1,0,13507,0.1091095334796455,0,1,0,0,1,Adulto
1,"Carter, Miss. Lucile Polk",14.0,1,2,113760,0.23422440102965048,0,1,0,0,0,Jovem
0,"Ford, Miss. Doolina Margaret ""Daisy""",21.0,2,2,W./C. 6608,0.06709553154495196,0,1,0,1,0,Adulto
1,"Richards, Mrs. Sidney (Emily Hocking)",24.0,2,3,29106,0.03659756266088288,0,1,1,0,0,Adulto
0,"Fortune, Mr. Mark",64.0,1,4,19950,0.5133418122566507,0,1,0,0,1,Idoso
0,"Kvillner, Mr. Johan Henrik Johannesson",31.0,0,0,C.A. 18723,0.020494635090094415,0,1,1,0,1,Adulto
1,"Hart, Mrs. Benjamin (Esther Ada Bloomfield)",45.0,1,1,F.C.C. 13529,0.05123658772523604,0,1,1,0,0,Adulto
0,"Hampe, Mr. Leon",20.0,0,0,345769,0.018542765081513996,0,1,0,1,1,Adulto
0,"Petterson, Mr. Johan Emil",25.0,1,0,347076,0.015175789316712771,0,1,0,1,1,Adulto
1,"Reynaldo, Ms. Encarnacion",28.0,0,0,230434,0.025374310111545468,0,1,1,0,0,Adulto
1,"Johannesen-Bratthammer, Mr. Bernt",25.14061971830986,0,0,65306,0.015834545444608664,0,1,0,1,1,Adulto
1,"Dodge, Master. Washington",4.0,0,2,33638,0.15977676072337862,0,1,0,0,1,Criança
1,"Mellinger, Miss. Madeleine Violet",13.0,0,1,250644,0.038061465167318204,0,1,1,0,0,Jovem
1,"Seward, Mr. Frederic Kimber",34.0,0,0,113794,0.051822148727810165,0,1,0,0,1,Adulto
1,"Baclini, Miss. Marie Catherine",5.0,2,1,2666,0.03758969818624431,0,0,0,1,0,Criança
1,"Peuchen, Major. Arthur Godfrey",52.0,0,0,113786,0.05953203526170282,0,1,0,0,1,Adulto
0,"West, Mr. Edwy Arthur",36.0,1,2,C.A. 34651,0.05416439273810667,0,1,1,0,1,Adulto
0,"Hagland, Mr. Ingvald Olai Olsen",25.14061971830986,1,0,65303,0.03897240290032268,0,1,0,1,1,Adulto
0,"Foreman, Mr. Benjamin Laventall",30.0,0,0,113051,0.05416439273810667,0,0,0,0,1,Adulto
1,"Goldenberg, Mr. Samuel L",49.0,1,0,17453,0.17391981561855152,0,0,0,0,1,Adulto
0,"Peduzzi, Mr. Joseph",25.14061971830986,0,0,A/5 2817,0.015712553569072387,0,1,0,1,1,Adulto
1,"Jalsevac, Mr. Ivan",29.0,0,0,349240,0.015411575213749286,0,0,0,1,1,Adulto
0,"Millet, Mr. Francis Davis",65.0,0,0,13509,0.051822148727810165,0,1,0,0,1,Idoso
1,"Kenyon, Mrs. Frederick R (Marion)",38.233440860215055,1,0,17464,0.10122885832000206,0,1,0,0,0,Adulto
1,"Toomey, Miss. Ellen",50.0,0,0,F.C.C. 13531,0.020494635090094415,0,1,1,0,0,Adulto
0,"O'Connor, Mr. Maurice",25.14061971830986,0,0,371060,0.015126992566498259,1,0,0,1,1,Adulto
1,"Anderson, Mr. Harry",48.0,0,0,19952,0.051822148727810165,0,1,0,0,1,Adulto
0,"Morley, Mr. William",34.0,0,0,364506,0.015712553569072387,0,1,0,1,1,Adulto
0,"Gee, Mr. Arthur H",47.0,0,0,111320,0.07514699533034619,0,1,0,0,1,Adulto
0,"Milling, Mr. Jacob Christian",48.0,0,0,234360,0.025374310111545468,0,1,1,0,1,Adulto
0,"Maisner, Mr. Simon",25.14061971830986,0,0,A/S 2816,0.015712553569072387,0,1,0,1,1,Adulto
0,"Goncalves, Mr. Manuel Estanslas",38.0,0,0,SOTON/O.Q. 3101306,0.013760683560491965,0,1,0,1,1,Adulto
0,"Campbell, Mr. William",29.87763005780347,0,0,239853,0.0,0,1,1,0,1,Adulto
0,"Smart, Mr. John Montgomery",56.0,0,0,113792,0.051822148727810165,0,1,0,0,1,Adulto
0,"Scanlan, Mr. James",25.14061971830986,0,0,36209,0.015078195816283748,1,0,0,1,1,Adulto
1,"Baclini, Miss. Helene Barbara",0.75,2,1,2666,0.03758969818624431,0,0,0,1,0,Criança
0,"Keefe, Mr. Arthur",25.14061971830986,0,0,323592,0.014151057562208049,0,1,0,1,1,Adulto
0,"Cacic, Mr. Luka",38.0,0,0,315089,0.016908073949327893,0,1,0,1,1,Adulto
1,"West, Mrs. Edwy Arthur (Ada Mary Worth)",33.0,1,2,C.A. 34651,0.05416439273810667,0,1,1,0,0,Adulto
1,"Jerwan, Mrs. Amin S (Marie Marthe Thuillard)",23.0,0,0,SC/AH Basle 541,0.026919605597338588,0,0,1,0,0,Adulto
0,"Strandberg, Miss. Ida Sofia",22.0,0,0,7553,0.019201521209409888,0,1,0,1,0,Adulto
0,"Clifford, Mr. George Quincy",38.233440860215055,0,0,110465,0.10149724044618187,0,1,0,0,1,Adulto
0,"Renouf, Mr. Peter Henry",34.0,1,0,31027,0.04098927018018883,0,1,1,0,1,Adulto
0,"Braund, Mr. Lewis Richard",29.0,1,0,3460,0.013752485706455927,0,1,0,1,1,Adulto
0,"Karlsson, Mr. Nils August",22.0,0,0,350060,0.014679623960531627,0,1,0,1,1,Adulto
1,"Hirvonen, Miss. Hildur E",2.0,0,1,3101298,0.023983602730431916,0,1,0,1,0,Criança
0,"Goodwin, Master. Harold Victor",9.0,5,2,CA 2144,0.09154270340242172,0,1,0,1,1,Criança
0,"Frost, Mr. Anthony Wood ""Archie""",29.87763005780347,0,0,239854,0.0,0,1,1,0,1,Adulto
0,"Rouse, Mr. Richard Henry",50.0,0,0,A/5 3594,0.015712553569072387,0,1,0,1,1,Adulto
1,"Turkula, Mrs. (Hedwig)",63.0,0,0,4134,0.018713553707264782,0,1,0,1,0,Idoso
1,"Bishop, Mr. Dickinson H",25.0,1,0,11967,0.17777475888549785,0,0,0,0,1,Adulto
0,"Lefebre, Miss. Jeannie",25.14061971830986,3,1,4133,0.049707687947515,0,1,0,1,0,Adulto
1,"Hoyt, Mrs. Frederick Maxfield (Jane Anne Forby)",35.0,1,0,19943,0.17566830077223786,0,1,0,0,0,Adulto
0,"Kent, Mr. Edward Austin",58.0,0,0,11771,0.057970539254838485,0,0,0,0,1,Adulto
0,"Somerton, Mr. Francis William",30.0,0,0,A.5. 18509,0.015712553569072387,0,1,0,1,1,Adulto
1,"Coutts, Master. Eden Leslie ""Neville""",9.0,1,1,C.A. 37671,0.031034733136428686,0,1,0,1,1,Criança
0,"Hagland, Mr. Konrad Mathias Reiersen",25.14061971830986,1,0,65304,0.03897240290032268,0,1,0,1,1,Adulto
0,"Windelov, Mr. Einar",21.0,0,0,SOTON/OQ 3101317,0.014151057562208049,0,1,0,1,1,Adulto
0,"Molson, Mr. Harry Markland",55.0,0,0,113787,0.05953203526170282,0,1,0,0,1,Adulto
0,"Artagaveytia, Mr. Ramon",71.0,0,0,PC 17609,0.09662576327876685,0,0,0,0,1,Idoso
0,"Stanley, Mr. Edward Roland",21.0,0,0,A/4 45380,0.015712553569072387,0,1,0,1,1,Adulto
0,"Yousseff, Mr. Gerious",25.14061971830986,0,0,2627,0.028220722145058292,0,0,0,1,1,Adulto
1,"Eustis, Miss. Elizabeth Mussey",54.0,1,0,36947,0.1527664244005612,0,0,0,0,0,Adulto
0,"Shellard, Mr. Frederick William",25.14061971830986,0,0,C.A. 6212,0.029473237129564348,0,1,0,1,1,Adulto
0,"Allison, Mrs. Hudson J C (Bessie Waldo Daniels)",25.0,1,2,113781,0.29580589980036276,0,1,0,0,0,Adulto
0,"Svensson, Mr. Olof",24.0,0,0,350035,0.015216388212891242,0,1,0,1,1,Adulto
0,"Calic, Mr. Petar",17.0,0,0,315086,0.016908073949327893,0,1,0,1,1,Jovem
0,"Canavan, Miss. Mary",21.0,0,0,364846,0.015126992566498259,1,0,0,1,0,Adulto
0,"O'Sullivan, Miss. Bridget Mary",25.14061971830986,0,0,330909,0.014891206669461744,1,0,0,1,0,Adulto
0,"Laitinen, Miss. Kristina Sofia",37.0,0,0,4135,0.018713553707264782,0,1,0,1,0,Adulto
1,"Maioni, Miss. Roberta",16.0,0,0,110152,0.16883675574220638,0,1,0,0,0,Jovem
0,"Penasco y Castellana, Mr. Victor de Satode",18.0,1,0,PC 17758,0.2125586439344078,0,0,0,0,1,Adulto
1,"Quick, Mrs. Frederick Charles (Jane Richards)",33.0,0,2,26360,0.050748620223090936,0,1,1,0,0,Adulto
1,"Bradley, Mr. George (""George Arthur Brayton"")",38.233440860215055,0,0,111427,0.051822148727810165,0,1,0,0,1,Adulto
0,"Olsen, Mr. Henry Margido",28.0,0,0,C 4001,0.04396587194327397,0,1,0,1,1,Adulto
1,"Lang, Mr. Fang",26.0,0,0,1601,0.11027245763075773,0,1,0,1,1,Adulto
1,"Daly, Mr. Eugene Patrick",29.0,0,0,382651,0.015126992566498259,1,0,0,1,1,Adulto
0,"Webber, Mr. James",25.14061971830986,0,0,SOTON/OQ 3101316,0.015712553569072387,0,1,0,1,1,Adulto
1,"McGough, Mr. James Robert",36.0,0,0,PC 17473,0.05130978285055781,0,1,0,0,1,Adulto
1,"Rothschild, Mrs. Martin (Elizabeth L. Barrett)",54.0,1,0,PC 17603,0.11594107850967697,0,0,0,0,0,Adulto
0,"Coleff, Mr. Satio",24.0,0,0,349209,0.014630827210317117,0,1,0,1,1,Adulto
0,"Walker, Mr. William Anderson",47.0,0,0,36967,0.06640417918791278,0,1,0,0,1,Adulto
1,"Lemore, Mrs. (Amelia Milley)",34.0,0,0,C.A. 34260,0.020494635090094415,0,1,1,0,0,Adulto
0,"Ryan, Mr. Patrick",25.14061971830986,0,0,371110,0.04713766070721715,1,0,0,1,1,Adulto
1,"Angle, Mrs. William A (Florence ""Mary"" Agnes Hughes)",36.0,1,0,226875,0.050748620223090936,0,1,1,0,0,Adulto
0,"Pavlovic, Mr. Stefo",32.0,0,0,349242,0.015411575213749286,0,1,0,1,1,Adulto
1,"Perreault, Miss. Anne",30.0,0,0,12749,0.18249984580226933,0,1,0,0,0,Adulto
0,"Vovk, Mr. Janko",22.0,0,0,349252,0.015411575213749286,0,1,0,1,1,Adulto
0,"Lahoud, Mr. Sarkis",25.14061971830986,0,0,2624,0.014102260811993537,0,0,0,1,1,Adulto
1,"Hippach, Mrs. Louis Albert (Ida Sophia Fischer)",44.0,0,1,111361,0.11316786160148591,0,0,0,0,0,Adulto
0,"Kassem, Mr. Fared",25.14061971830986,0,0,2700,0.014110458666029575,0,0,0,1,1,Adulto
0,"Farrell, Mr. James",40.5,0,0,367232,0.015126992566498259,1,0,0,1,1,Adulto
1,"Ridsdale, Miss. Lucy",50.0,0,0,W./C. 14258,0.020494635090094415,0,1,1,0,0,Adulto
0,"Farthing, Mr. John",38.233440860215055,0,0,PC 17483,0.4328841690069588,0,1,0,0,1,Adulto
0,"Salonen, Mr. Johan Werner",39.0,0,0,3101296,0.015468569817999833,0,1,0,1,1,Adulto
0,"Hocking, Mr. Richard George",23.0,2,1,29104,0.022446505098674838,0,1,1,0,1,Adulto
1,"Quick, Miss. Phyllis May",2.0,1,1,26360,0.050748620223090936,0,1,1,0,0,Criança
0,"Toufik, Mr. Nakli",25.14061971830986,0,0,2641,0.014110458666029575,0,0,0,1,1,Adulto
0,"Elias, Mr. Joseph Jr",17.0,1,1,2690,0.014110458666029575,0,0,0,1,1,Jovem
1,"Peter, Mrs. Catherine (Catherine Rizk)",25.14061971830986,0,2,2668,0.04364049521284362,0,0,0,1,0,Adulto
0,"Cacic, Miss. Marija",30.0,0,0,315084,0.016908073949327893,0,1,0,1,0,Adulto
1,"Hart, Miss. Eva Miriam",7.0,0,2,F.C.C. 13529,0.05123658772523604,0,1,1,0,0,Criança
0,"Butt, Major. Archibald Willingham",45.0,0,0,113050,0.051822148727810165,0,1,0,0,1,Adulto
1,"LeRoy, Miss. Bertha",30.0,0,0,PC 17761,0.20772776566317125,0,0,0,0,0,Adulto
0,"Risien, Mr. Samuel Beard",25.14061971830986,0,0,364498,0.028302115124416098,0,1,0,1,1,Adulto
1,"Frolicher, Miss. Hedwig Margaritha",22.0,0,2,13568,0.09661756542473082,0,0,0,0,0,Adulto
1,"Crosby, Miss. Harriet R",36.0,0,2,WE/P 5735,0.13858277060920987,0,1,0,0,0,Adulto
0,"Andersson, Miss. Ingeborg Constanzia",9.0,4,2,347082,0.06104473451835265,0,1,0,1,0,Criança
0,"Andersson, Miss. Sigrid Elisabeth",11.0,4,2,347082,0.06104473451835265,0,1,0,1,0,Criança
1,"Beane, Mr. Edward",32.0,1,0,2908,0.050748620223090936,0,1,1,0,1,Adulto
0,"Douglas, Mr. Walter Donald",50.0,1,0,PC 17761,0.20772776566317125,0,0,0,0,1,Adulto
0,"Nicholson, Mr. Arthur Ernest",64.0,0,0,693,0.050748620223090936,0,1,0,0,1,Idoso
1,"Beane, Mrs. Edward (Ethel Clarke)",19.0,1,0,2908,0.050748620223090936,0,1,1,0,0,Adulto
1,"Padro y Manent, Mr. Julian",29.87763005780347,0,0,SC/PARIS 2146,0.02705779799394608,0,0,1,0,1,Adulto
0,"Goldsmith, Mr. Frank John",33.0,1,1,363291,0.04006213192611313,0,1,0,1,1,Adulto
1,"Davies, Master. John Morgan Jr",8.0,1,1,C.A. 33112,0.07173122281533045,0,1,1,0,1,Criança
1,"Thayer, Mr. John Borland Jr",17.0,0,2,17421,0.21642978772242535,0,0,0,0,1,Jovem
0,"Sharp, Mr. Percival James R",27.0,0,0,244358,0.050748620223090936,0,1,1,0,1,Adulto
0,"O'Brien, Mr. Timothy",25.14061971830986,0,0,330979,0.015281580671177828,1,0,0,1,1,Adulto
1,"Leeni, Mr. Fahim (""Philip Zenni"")",22.0,0,0,2620,0.014102260811993537,0,0,0,1,1,Adulto
1,"Ohman, Miss. Velin",22.0,0,0,347085,0.015175789316712771,0,1,0,1,0,Adulto
0,"Wright, Mr. George",62.0,0,0,113807,0.051822148727810165,0,1,0,0,1,Idoso
1,"Duff Gordon, Lady. (Lucille Christiana Sutherland) (""Mrs Morgan"")",48.0,1,0,11755,0.07729405233978466,0,0,0,0,0,Adulto
0,"Robbins, Mr. Victor",38.233440860215055,0,0,PC 17757,0.4440992237022602,0,0,0,0,1,Adulto
1,"Taussig, Mrs. Emil (Tillie Mandelbaum)",39.0,1,1,110413,0.1554664461834305,0,1,0,0,0,Adulto
1,"de Messemaeker, Mrs. Guillaume Joseph (Emma)",36.0,1,0,345572,0.033962538149299316,0,1,0,1,0,Adulto
0,"Morrow, Mr. Thomas Rowan",25.14061971830986,0,0,372622,0.015126992566498259,1,0,0,1,1,Adulto
0,"Sivic, Mr. Husein",40.0,0,0,349251,0.015411575213749286,0,1,0,1,1,Adulto
0,"Norman, Mr. Robert Douglas",28.0,0,0,218629,0.026350245115835676,0,1,1,0,1,Adulto
0,"Simmons, Mr. John",25.14061971830986,0,0,SOTON/OQ 392082,0.015712553569072387,0,1,0,1,1,Adulto
0,"Meanwell, Miss. (Marion Ogden)",25.14061971830986,0,0,SOTON/O.Q. 392087,0.015712553569072387,0,1,0,1,0,Adulto
0,"Davies, Mr. Alfred J",24.0,2,0,A/4 48871,0.04713766070721715,0,1,0,1,1,Adulto
0,"Stoytcheff, Mr. Ilia",19.0,0,0,349205,0.015411575213749286,0,1,0,1,1,Adulto
0,"Palsson, Mrs. Nils (Alma Cornelia Berglund)",29.0,0,4,349909,0.04113566043083236,0,1,0,1,0,Adulto
0,"Doharr, Mr. Tannous",25.14061971830986,0,0,2686,0.014110458666029575,0,0,0,1,1,Adulto
1,"Jonsson, Mr. Carl",32.0,0,0,350417,0.015330377421392339,0,1,0,1,1,Adulto
1,"Harris, Mr. George",62.0,0,0,S.W./PP 752,0.020494635090094415,0,1,1,0,1,Idoso
1,"Appleton, Mrs. Edward Dale (Charlotte Lamson)",53.0,2,0,11769,0.10048070654571319,0,1,0,0,0,Adulto
1,"Flynn, Mr. John Irwin (""Irving"")",36.0,0,0,PC 17474,0.051504969851415845,0,1,0,0,1,Adulto
1,"Kelly, Miss. Mary",25.14061971830986,0,0,14312,0.015126992566498259,1,0,0,1,0,Adulto
0,"Rush, Mr. Alfred George John",16.0,0,0,A/4. 20589,0.015712553569072387,0,1,0,1,1,Jovem
0,"Patchett, Mr. George",19.0,0,0,358585,0.028302115124416098,0,1,0,1,1,Adulto
1,"Garside, Miss. Ethel",34.0,0,0,243880,0.025374310111545468,0,1,1,0,0,Adulto
1,"Silvey, Mrs. William Baird (Alice Munger)",39.0,1,0,13507,0.1091095334796455,0,1,0,0,0,Adulto
0,"Caram, Mrs. Joseph (Maria Elias)",25.14061971830986,1,0,2689,0.028220722145058292,0,0,0,1,0,Adulto
1,"Jussila, Mr. Eiriik",32.0,0,0,STON/O 2. 3101286,0.015468569817999833,0,1,0,1,1,Adulto
1,"Christy, Miss. Julie Rachel",25.0,1,1,237789,0.05855610025741262,0,1,1,0,0,Adulto
